{
  "id": "FIREWALL",
  "name": "Firewall",
  "description": "Create a wall of flames 5 tiles wide. Area denial.",
  "slot": "utility",
  "icon": "🧱",
  "keywords": [
    "FIRE",
    "WALL",
    "AREA_DENIAL"
  ],
  "baseVariables": {
    "range": 4,
    "cost": 1,
    "cooldown": 4,
    "basePower": 1,
    "damage": 1
  },
  "combat": {
    "damageClass": "magical",
    "damageSubClass": "blast",
    "damageElement": "fire",
    "attackProfile": "spell",
    "trackingSignature": "magic",
    "weights": {
      "mind": 1
    }
  },
  "targeting": {
    "generator": "axial_ray",
    "range": 4,
    "deterministicSort": "distance_then_q_then_r"
  },
  "combatScript": [
    {
      "id": "firewall_damage",
      "kind": "DEAL_DAMAGE",
      "phase": "resolution",
      "target": "selected_hex",
      "pointPattern": {
        "kind": "perpendicular_line",
        "center": "selected_hex",
        "relativeTo": "caster_to_selected",
        "totalLength": 5
      },
      "pointFilters": [
        "skip_blocked_by_wall"
      ],
      "resolution": "combat",
      "combatPointTargetMode": "actor_only",
      "reason": "firewall_impact",
      "statusMultiplierSources": [
        {
          "type": "surface_skill_power",
          "skillId": "FIREWALL"
        }
      ]
    },
    {
      "id": "firewall_surface",
      "kind": "PLACE_SURFACE",
      "phase": "resolution",
      "surface": "fire",
      "target": "selected_hex",
      "pointPattern": {
        "kind": "perpendicular_line",
        "center": "selected_hex",
        "relativeTo": "caster_to_selected",
        "totalLength": 5
      },
      "pointFilters": [
        "skip_blocked_by_wall"
      ],
      "duration": 3
    },
    {
      "id": "firewall_flash",
      "kind": "EMIT_JUICE",
      "phase": "cleanup",
      "effect": "flash",
      "target": "selected_hex",
      "color": "#ffaa00",
      "metadata": {
        "signature": "ATK.BLAST.FIRE.FIREWALL",
        "family": "attack",
        "primitive": "blast",
        "phase": "impact",
        "element": "fire",
        "variant": "firewall",
        "targetRef": {
          "kind": "target_hex"
        },
        "skillId": "FIREWALL"
      }
    },
    {
      "id": "firewall_message",
      "kind": "MESSAGE",
      "phase": "cleanup",
      "text": "Firewall raised!"
    }
  ],
  "upgrades": {}
}
